{
  "$schema": "./schema.demo.json",
  "name": "agent-invoke",
  "profile": "game",
  "size": [1280, 720],
  "fps": 30,
  "hold_ms_default": 800,
  "native_only": true,
  "steps": [
    {"wait_ms": 400},
    {"ui_click": "shell.agent.send_button"},
    {"wait_ms": 600},
    {"capture": "frame"},
    {"capture": "frame"}
  ]
}
